{
  "content_id": "19ed8498-37ed-4c8e-b0bf-accbb2cf5477",
  "base_path": "/browse",
  "format": "mainstream_browse_page",
  "locale": "en",
  "public_updated_at": "2015-04-20T15:46:10.000+00:00",
  "publishing_app": "collections-publisher",
  "rendering_app": "collections",
  "update_type": "major",
  "links": {
    "top_level_browse_pages": [
      "3c0557d1-518e-4a9b-8920-78524944a28c",
      "94ecd143-c60f-4981-a914-242d0c3b0bd1",
      "88c8dabd-ff05-4530-99ff-ecf3294a9949"
    ]
  },
  "routes": [
    {
      "path": "/browse",
      "type": "exact"
    }
  ]
}
