{
  "content_id": "19ed8498-37ed-4c8e-b0bf-accbb2cf5477",
  "base_path": "/browse",
  "description": "Almost everything on GOV.UK.",
  "details": {},
  "format": "mainstream_browse_page",
  "locale": "en",
  "need_ids": [],
  "public_updated_at": "2015-04-20T15:46:10.000+00:00",
  "publishing_app": "collections-publisher",
  "rendering_app": "collections",
  "update_type": "major",
  "title": "Browse",
  "routes": [
    {
      "path": "/browse",
      "type": "exact"
    }
  ]

}
